review_id,product_id,customer_id,rating,review_text,review_date
299,45,221,5,Eat language school account figure air tree western.,2024-07-15
300,35,380,3,They source benefit institution recognize eat save space town education network agree.,2024-12-24
301,82,90,2,Cause feel produce relate push let left marriage design fight full hot.,2024-07-31
302,42,232,1,Defense might natural market inside international born.,2025-01-18
303,5,323,4,My bill star ok recent your rest eat prepare scene.,2025-01-27
304,27,258,4,Music something care lot choice security even report whom offer.,2024-10-09
305,70,153,1,Him care leave develop note tough bit protect prove art.,2024-05-04
306,62,256,4,Development live top remain growth commercial recently government.,2024-12-14
307,32,403,5,Pull mission wrong president why quickly.,2024-11-21
308,8,424,5,Conference reach store resource world receive ability question hope bring particularly.,2025-03-06
309,85,258,5,Something alone international style hotel force religious stock gun new lay nor.,2024-05-22
310,18,467,3,Girl draw major nor size firm hair government message since offer walk the.,2024-12-26
311,78,65,1,Great economic feeling teacher floor approach wall trial moment.,2024-11-18
312,15,190,5,Election staff loss ball it read entire theory according individual.,2025-01-25
313,26,91,2,Information night share official movie stand bit pattern stand throw.,2024-08-22
314,53,438,5,Measure away baby however hope amount between still enter.,2024-07-31
315,44,173,3,Middle center doctor politics commercial now ready building actually main.,2025-01-22
316,32,247,2,Throughout politics agency important simply stuff offer enjoy under out.,2024-09-27
317,28,256,1,In audience key reflect relationship fall summer up plan professional high.,2024-09-01
318,39,116,1,Than citizen capital before economic become over affect your.,2024-05-08
319,32,49,5,Event dinner hear drive weight start bill treatment meeting coach.,2024-09-03
320,77,227,2,Free home only interest have feeling section.,2024-11-11
321,79,489,2,Wide south another population imagine bar strong space heart take low couple.,2024-07-15
322,18,69,5,Most matter health eat specific sea fast down energy.,2025-02-28
323,70,422,5,Expert if laugh today American Mr well.,2025-03-16
324,11,388,4,Performance high report rule ground past free.,2024-06-23
325,32,401,4,Still left chair billion name blue.,2024-06-22
326,20,126,5,Memory think experience give example thus line sign natural occur.,2025-03-02
327,97,437,3,Water parent citizen short professor agree.,2024-08-29
328,40,213,4,Dream home strategy open race boy paper him sport.,2024-12-31
329,8,53,5,Republican step left popular mention necessary organization line study head its.,2024-06-05
330,35,112,2,Score here imagine give beautiful reason east my their film.,2025-03-03
331,69,159,4,Care benefit artist current worry lay out sign remain soldier dinner many.,2024-12-26
332,99,240,3,Research stand into game source including PM road scene choose keep military car.,2024-12-17
333,78,150,1,Arrive although much end woman conference great ago owner treat like.,2024-08-12
334,21,139,2,Scientist answer end kind suggest listen.,2024-09-12
335,24,418,3,Size receive sing avoid score husband.,2025-03-08
336,17,113,3,Garden about sense today every talk per food specific.,2024-12-20
337,18,143,3,Raise lead example brother similar catch task cultural show southern place customer itself change.,2025-02-11
338,98,370,2,Owner partner their chair father PM business reveal help trade discover nice century.,2024-10-30
339,12,138,3,Fight push hard threat born keep clearly single.,2024-11-20
340,16,486,1,Close act company day and people.,2024-07-02
341,4,480,4,Form hot our five soldier lead stage adult lead example.,2025-01-19
342,89,437,2,Sign analysis ability grow record provide get child read care forward.,2024-11-14
343,34,304,3,Control surface art individual total everything experience miss hard quite remain despite at.,2024-11-05
344,92,31,5,Exactly than investment only anything likely many.,2025-01-05
345,46,293,4,Position sense computer week them get plan hard could.,2024-06-02
346,75,108,2,Language little practice factor smile identify.,2024-05-18
347,77,284,5,Walk measure site area standard computer administration capital company choice.,2024-07-04
348,31,159,5,Late agree person region newspaper wide bar administration right yes guy.,2024-11-30
349,25,326,3,Address end along trade dog level easy stop must rule part.,2024-04-28
350,74,14,2,Bring your ball dark group catch growth pressure system admit candidate.,2024-05-16
351,24,122,3,Leg push note weight who light.,2025-01-21
352,65,215,1,Section fish response discuss girl plant outside put white.,2024-09-27
353,25,272,5,Them fine lay bar rich those hotel eat claim.,2025-01-11
354,28,25,1,Her coach consider himself land fund whose off would ask security popular.,2024-08-02
355,36,423,3,Reach nice every win lose school.,2025-03-17
356,82,322,4,Stand ever car individual but hit court article and term.,2024-08-07
357,6,294,5,Everything decide few sign east woman safe something tree central.,2024-07-12
358,66,169,4,Which prepare certain record across meet region thousand hospital born respond.,2024-09-12
359,67,103,2,Present argue total own store picture instead white and.,2024-07-27
360,72,354,5,Authority also phone real surface court bill relate country attorney collection visit.,2025-02-20
361,95,371,1,Charge government home town avoid meet you cold score.,2024-06-09
362,48,40,4,Land fall region return board first.,2024-07-26
363,83,235,2,More character audience many never wonder baby night ask foot member a our.,2024-06-08
364,70,320,5,Responsibility market group similar material trade its maybe.,2024-11-23
365,78,89,2,Whom success laugh animal draw imagine local to deep attorney religious memory office.,2025-03-29
366,67,100,1,Everybody it easy whose first test six cultural write gas behavior eight also.,2024-08-21
367,48,144,5,Enjoy act together first daughter measure.,2024-05-03
368,65,82,2,Consider federal send later player service American start garden subject war moment.,2025-03-01
369,44,77,3,Run wife church international wide strong offer available hope.,2024-06-21
370,94,59,5,Care line key fact want watch foot sister.,2025-01-16
371,63,229,5,Word yeah bill forget remember support hold serve beat certainly.,2025-02-24
372,46,91,5,Support stay meet future goal member determine increase audience.,2024-08-26
373,19,354,5,To window bit Republican draw take agency somebody ok nation see.,2025-03-29
374,64,395,3,Record debate write fly myself first west close act know.,2024-04-23
375,83,1,1,Into image region media moment drug modern.,2025-02-21
376,73,269,3,Skill husband among four way ten move live.,2024-08-18
377,71,286,3,Sign throughout dinner with attack end.,2025-01-05
378,50,197,2,Generation reflect east phone floor technology begin guess foot something financial.,2025-01-19
379,63,274,4,Ever very whatever during us fast industry TV.,2024-07-19
380,41,78,4,Husband person tend actually well opportunity response energy move indicate step.,2024-11-21
381,7,141,2,Experience continue fly size long claim great management.,2024-10-23
382,9,288,3,Knowledge direction wait page sing issue amount far resource me former.,2024-07-22
383,4,71,2,Actually firm man economic box represent individual.,2025-04-14
384,89,456,5,Admit gas alone TV class mouth direction last our camera how other.,2025-03-22
385,49,50,2,Imagine chance evidence rate measure too statement indicate party western.,2024-06-12
386,76,455,2,Call voice establish by behind more difficult represent fish exist along see.,2024-11-23
387,6,372,5,Voice win strong positive skin surface participant notice evening push degree.,2024-11-13
388,82,369,4,Stop not clearly me every whom part.,2024-05-13
389,21,80,5,Look mean wrong night agree product position.,2024-07-04
390,15,235,1,Wear attention election from hit nice here direction part last.,2024-12-29
391,67,287,2,Receive near use operation plant evening beautiful compare.,2024-10-19
392,66,307,2,Truth modern interview then reflect generation operation conference five college cup.,2024-04-21
393,56,155,4,Some star sister bar enjoy against trouble article.,2024-05-17
394,68,60,3,Year campaign candidate beautiful simple performance him positive.,2024-07-05
395,32,33,5,All chair within four religious religious grow off bit professional stand.,2025-04-04
396,66,437,3,Study discussion shake exactly fact now choice else camera despite us only.,2024-10-08
397,29,127,1,Television sound town law charge old onto cause upon give television program.,2024-10-02
398,66,221,5,Over gun drive ok himself become fill represent two successful field building food.,2024-09-08
399,34,200,1,Manage kind early name same also especially shake character entire read notice.,2024-11-30
400,27,417,1,Method style game school add PM investment would wait card tonight rest raise.,2024-07-20
401,60,126,1,Town city others unit win hit story number military board building too.,2024-09-02
402,39,41,5,Food tree tax training child property.,2024-08-30
403,44,275,5,Hear marriage eye sure maybe try hard.,2024-12-20
404,82,469,4,Heavy girl thought street radio industry water would everybody range American evening add.,2025-04-04
405,36,297,2,Pick break get culture green off similar mind great each tax peace.,2024-10-31
406,19,85,3,Raise safe age few event ball young reflect one vote popular free step.,2024-06-13
407,91,89,3,Describe successful south particularly between top knowledge husband side sense.,2025-01-02
408,45,42,1,Cell card nice east religious special money huge.,2024-11-24
409,84,120,5,Probably television what certain arrive dinner century young from.,2024-07-08
410,21,279,5,Tree nation up and newspaper risk smile against whom.,2024-07-09
411,23,459,1,From PM citizen indeed see theory save crime front pressure cold office rock dinner.,2024-09-01
412,94,33,2,Hospital race pull their performance wrong agent push main attention money.,2024-09-09
413,89,276,3,Establish movie stuff drug trouble writer owner store.,2025-03-16
414,95,153,4,Walk ready admit live into young economy natural rule company half up.,2024-09-01
415,27,90,2,Would across site everyone tough central peace place others wide position.,2024-09-21
416,98,104,5,Likely manager sister less wind skill large news research.,2024-05-25
417,72,436,1,People prove analysis sing strategy trade operation fill land pull site card.,2024-05-19
418,19,12,3,Program wrong wish involve every financial shoulder recognize care.,2025-01-18
419,41,160,1,Federal kid factor able this at.,2025-01-27
420,26,417,5,More possible should main key behavior probably upon.,2024-10-24
421,28,458,1,Ten toward reflect cover tree I court.,2025-02-22
422,64,196,3,Perhaps more field news list certain human stand.,2024-11-21
423,68,399,1,Sea information thought future be woman boy offer consider without.,2024-07-01
424,95,307,3,Amount yeah with point sure affect.,2024-10-04
425,80,262,1,Physical staff stay dark not benefit imagine east place region town.,2024-04-22
426,51,91,1,Conference finally cold teach become where expert story serious.,2024-11-05
427,74,197,3,Art bit grow leg believe much pass throughout until particular parent.,2025-03-22
428,48,69,1,Second institution example poor exactly have live billion give sure billion including what.,2024-08-18
429,10,466,2,Necessary message garden name scientist style indicate commercial type.,2024-08-10
430,73,220,4,Need process have catch report daughter.,2024-07-22
431,39,419,2,Sell democratic we structure leader worry second result bill year.,2024-12-12
432,100,379,4,Child ready catch card lead one high wide a state maybe visit coach.,2024-10-17
433,100,214,2,His win player sit institution detail will during case fear conference its today.,2024-07-16
434,19,418,4,Success drive have assume whole fill suggest newspaper role.,2025-04-05
435,64,447,1,Strategy his what behind leg nice what citizen fire.,2024-10-27
436,19,452,3,Also important more difficult nation evening challenge hot.,2024-12-22
437,76,146,3,Performance detail see still nearly war name tend dog ability write nature.,2024-07-08
438,62,233,5,Region popular traditional local pretty board ground summer room war.,2024-11-05
439,13,371,4,Drive son make purpose thousand myself live.,2024-06-16
440,25,410,5,Hard whose end rate take attack candidate data challenge right simply.,2024-07-03
441,100,234,5,Country send especially sometimes shake water available heavy result scene heart.,2024-05-29
442,89,214,4,Million huge pay answer successful modern example recently budget.,2024-11-06
443,92,367,3,Teach throw method nor suggest job.,2024-05-11
444,42,481,4,Next actually executive challenge any need church.,2024-04-26
445,39,61,1,Democratic soon point support force no may situation center.,2024-04-16
446,30,363,5,Activity anyone rather series send about quickly even dinner show television public.,2024-08-11
447,5,78,5,Animal art company company quickly prevent worry get near event us soon.,2024-10-14
448,81,95,4,History to offer safe professor eat edge serious now analysis game next community.,2025-01-30
449,18,330,5,Picture particular professor big year determine chance building.,2024-11-15
450,21,499,3,Seek oil two believe why week.,2024-10-16
451,86,216,5,Outside executive behind nearly social building ok herself anything believe hold budget.,2024-09-14
452,50,213,4,Knowledge month camera plan court care born make detail top leave glass.,2024-10-18
453,6,304,3,Only win resource fear black into stand guy personal build radio.,2024-10-02
454,50,200,3,Address Mr recognize dinner door night audience force where among.,2024-09-24
455,80,352,5,Actually adult wife would direction little art leg majority particularly environment director spring.,2024-05-18
456,66,31,4,Which happen party air call poor choose front reveal seat thought Congress investment.,2024-11-09
457,1,290,5,Likely now statement another whether later single catch leg travel size his occur.,2024-05-14
458,57,343,1,How suddenly on meet night public recognize race.,2024-10-26
459,30,473,1,Community value yourself nation agent eye thing man.,2024-12-23
460,58,135,3,Along condition heavy miss politics day ability increase another.,2025-02-22
461,52,83,5,Large according drug bar whether top story.,2024-05-27
462,37,391,1,Receive traditional doctor traditional star card type candidate reduce represent.,2024-12-03
463,48,47,2,Professor husband show particularly worker institution find.,2024-06-12
464,87,392,1,Food off market street region defense pull play.,2024-09-08
465,1,206,5,Cold start seat power score every author college gas instead Mr.,2024-09-18
466,19,385,5,Suggest probably no recently down her somebody yeah stop almost share democratic event.,2024-08-27
467,46,381,1,Yeah action dark involve from particularly involve.,2024-09-01
468,67,77,5,Prepare should may them dog arm Mr view.,2025-03-22
469,2,259,5,Without call full once feeling fear create.,2024-10-08
470,56,437,2,Including young total with expect learn yourself the.,2025-04-08
471,17,92,3,Above community challenge leg large a environment draw financial ok office cultural.,2024-08-19
472,92,422,5,Spend economy plant budget pay moment TV join by away soldier position without.,2025-03-13
473,82,435,4,At lot say cut third memory analysis discussion.,2024-12-21
474,97,399,3,Significant determine food reflect tend also with.,2024-05-06
475,79,100,3,Wall remain could or agency could.,2025-03-17
476,22,383,4,Class receive purpose us wish factor teach you and focus time.,2025-01-07
477,27,195,1,However make none cost enter nothing chair miss central feel yard future available.,2025-03-01
478,55,192,2,Season election middle worry what indicate ago before feeling.,2024-12-28
479,32,68,5,Sea about whole everybody move drive right actually whom measure power listen eight.,2025-01-21
480,60,389,1,Lot miss season into free structure show main way individual more admit that chair.,2024-08-06
481,83,242,4,Less management nature direction prevent begin line recognize.,2024-12-05
482,28,90,2,Indeed seem more yet particular suffer song nor turn card continue others something.,2024-11-02
483,28,345,2,Relate wear nation probably case various industry reason.,2025-03-08
484,74,10,2,Technology he girl suffer science man issue.,2024-07-01
485,84,264,4,Without level stock spend contain move either but budget south officer.,2024-07-27
486,25,268,1,Into performance instead better some candidate prevent thought course.,2025-01-06
487,85,320,5,Chance difference different man very old.,2024-08-23
488,78,118,2,Main threat special important race future common actually material feeling clearly check goal.,2024-11-17
489,86,250,2,Dinner suddenly mother feeling hair director remain glass.,2024-12-21
490,26,59,1,Bed a everyone generation cell term catch conference save building certainly.,2024-08-01
491,75,195,2,Walk popular have listen special pay country.,2024-07-06
492,71,475,2,See respond record agency bed significant adult degree into pattern their.,2024-08-27
493,17,50,4,Table data human where for accept recognize open.,2024-08-19
494,82,407,3,Also city various contain middle perhaps usually return never few six late time.,2024-07-16
495,7,296,1,Painting doctor eight somebody live number democratic particular.,2025-02-19
496,56,378,1,Lead put right hair perform big option fine great rate section.,2025-01-13
497,64,97,1,Particular hit mean drop so whose get successful play hour sense minute news.,2024-09-20
498,20,462,4,Yeah purpose leader significant information pass human design for talk.,2024-06-20
499,38,127,4,Group turn strong if choice offer price support.,2024-05-16
500,75,246,5,Concern maybe nice job short break success quality whether night.,2024-07-07
501,58,87,4,Local weight until century yourself on usually forward.,2024-07-14
502,16,479,1,Necessary life may sort certainly far man.,2024-08-16
503,51,77,5,Understand growth cost can thank visit.,2025-02-15
504,27,377,3,Without inside environmental skin contain red hotel professor.,2024-12-03
505,51,204,2,Interesting avoid leave energy activity set lawyer behind.,2025-04-15
506,75,483,2,Heavy senior main kind already reach.,2024-05-24
507,16,146,5,Store executive including responsibility receive blood check able.,2024-08-17
508,87,149,3,Analysis place identify instead hotel age low force.,2024-12-14
509,60,493,2,Everyone phone draw upon talk common college eight.,2024-04-29
510,76,111,5,East win member under recognize watch various foot skin movie clear organization film.,2024-08-16
511,40,490,4,If seek thus history might speak second person last party effect.,2024-12-07
512,67,129,1,West program admit country able business easy clear seem artist tree stand life.,2024-11-03
513,2,253,3,Within speech reflect than if government child lawyer out her want night popular.,2024-11-12
514,48,166,2,Leader apply answer set family east show fish like wall rather.,2024-11-30
515,52,297,1,Notice marriage life let set alone approach sport.,2024-09-13
516,24,426,5,Ago industry address behind certain provide positive yes anyone lay own they sense.,2024-10-26
517,93,495,2,Lawyer small meet value what program feel campaign stop himself.,2024-07-20
518,98,137,1,Letter smile forget keep do trouble ever within or list short whether.,2024-10-30
519,84,279,4,At our green agency even alone part property agree system successful together.,2025-03-12
520,82,334,3,Child beat while almost rule statement training company those expect help.,2024-11-03
521,78,11,5,Plant nation five again car above study Mrs class.,2024-10-12
522,82,71,2,Lead best little effort find certain few political add western case.,2024-06-26
523,2,159,4,Yes impact pick enter increase key win sometimes agent Democrat.,2025-01-22
524,65,216,3,Reduce those would talk reflect personal fish investment protect way analysis can not.,2024-12-07
525,20,26,3,The morning son song power would ability provide sister.,2024-09-24
526,34,286,4,Pretty old resource add four challenge remember natural street free need.,2025-04-01
527,41,162,2,Current understand question factor some at first contain trip break story.,2024-09-13
528,41,430,3,Set high campaign your cell chance rather.,2025-04-01
529,75,102,5,Actually seven I by speech check include cold direction soldier support.,2025-04-03
530,91,69,1,Ground win together beat exist animal car however we.,2025-01-03
531,23,133,5,Learn cut safe senior practice middle pass coach four me support Democrat dinner.,2024-08-10
532,38,189,3,Occur reduce car quite nothing form consider college each check.,2024-08-30
533,44,211,1,Person miss coach treatment paper reflect stand.,2025-04-07
534,67,243,4,Term only risk company perhaps relationship realize late notice pressure street treat.,2024-10-01
535,62,166,1,Court including occur ground respond cold thought them common.,2024-11-16
536,12,412,1,Kid its focus break low PM level Republican produce other mother.,2024-05-18
537,30,410,1,Huge music center thought rather western road provide enter right party book.,2024-07-15
538,95,61,3,Outside process manager sister car response start toward easy especially early tree itself.,2024-09-25
539,87,362,2,Lawyer live audience if board career.,2024-04-23
540,65,279,3,Doctor because tough standard put level computer theory spend hit more reveal best long.,2024-11-05
541,41,430,2,Indicate man speak themselves stage soon computer tell yeah indeed report.,2025-03-06
542,20,113,4,With every system call many tough well task two law continue recognize type.,2024-11-02
543,6,30,4,Heart listen right type team move government everything interest.,2024-12-22
544,75,323,4,Decision yeah next report agency do admit star argue.,2025-03-26
545,99,476,4,In west unit happen enjoy floor want involve.,2025-03-30
546,4,161,4,Turn run control option office both.,2025-03-23
547,93,234,5,Hospital manager recognize catch company reason impact together teach weight.,2024-08-27
548,10,387,3,Remember them heavy top degree think marriage really good phone.,2024-04-18
549,51,453,2,Probably bag different detail note left PM democratic.,2024-05-21
550,93,377,4,Too news reach know real change someone.,2025-01-20
551,38,339,5,President for guess cultural few none story collection find image fear game.,2024-09-09
552,1,170,5,Seven yeah expect wife police around say reveal today.,2024-12-14
553,8,318,5,Company his address once apply Congress seek development.,2024-08-26
554,81,186,3,Leader line expect professional add situation need.,2025-02-13
555,83,57,4,We this wind ago mother moment cost new almost.,2024-08-10
556,63,240,5,Girl month person machine traditional try prevent loss.,2025-01-05
557,33,257,5,Store race assume teacher performance system.,2024-10-07
558,15,358,4,Military thus future without author bill trouble back.,2024-07-15
559,31,201,3,Level attention beyond tree somebody defense wear world rest clear effect grow energy.,2024-06-12
560,21,444,5,Time father term cut away officer about send.,2025-02-14
561,3,325,2,Body win woman economy nice debate activity test reduce.,2025-01-28
562,66,315,1,Poor ten image tell politics charge central firm source.,2024-08-20
563,35,302,1,Sometimes growth avoid public shoulder ability edge message upon teacher.,2025-01-31
564,41,106,1,Carry either moment perhaps foreign pressure tell accept down she add fire.,2025-03-21
565,59,290,3,Source yes least answer probably sell arm hospital range usually policy method interesting.,2024-05-03
566,16,101,5,Point her world seat someone town care wrong even game.,2024-05-12
567,56,97,1,Stop enough chair remember measure actually adult miss prove full treat.,2025-02-18
568,45,153,1,Everybody conference crime early meet condition one hotel how woman each.,2024-10-22
569,59,426,4,Chair star system task buy material could now at born.,2024-12-12
570,50,29,5,But suddenly as consumer there future born development.,2024-07-25
571,85,153,5,Finally fast Republican accept only price common.,2025-02-03
572,12,438,4,Peace scene after piece pay bit woman movie building.,2024-07-15
573,92,379,5,Oil teacher number affect morning computer wonder similar be.,2024-09-03
574,12,73,2,Write serve test less very work size professor instead fight avoid see.,2024-12-17
575,33,254,3,Fish floor listen there fire instead leave hundred mean last his.,2024-08-23
576,84,451,4,Tonight alone whole one feeling usually charge what whatever through fast.,2024-06-10
577,49,399,1,Player ok ability people fly will financial if rate daughter interest unit house.,2025-04-14
578,21,4,5,Whatever appear its adult husband listen service raise chance.,2024-12-05
579,60,237,2,Suffer senior cause follow quickly share per news.,2024-05-28
580,52,38,2,Call story student ask off science buy of what hospital fine.,2024-05-21
581,54,20,3,Indeed join key Republican interest pull threat challenge action several former per.,2024-06-11
582,39,113,2,Whether two summer teacher vote various put drop here scene time perform center.,2024-12-04
583,49,23,5,Once create indeed worry value network practice kind process cost class visit.,2024-09-12
584,64,421,5,To baby than ability speak spring knowledge whom.,2024-09-25
585,100,446,2,Sing respond southern success student drug protect avoid sound hotel affect.,2025-02-21
586,86,367,5,Dog top company six hospital style school.,2024-12-04
587,26,136,5,Inside catch heart this a environment project such until usually.,2024-08-18
588,71,421,1,Very today arm it structure send popular thank.,2024-10-25
589,7,248,4,Director three second along enough hour.,2024-10-04
590,72,301,5,Next operation need drop question practice cell threat hope seek get.,2024-09-05
591,62,97,5,Some deal or as positive feeling ever too.,2024-07-02
592,90,33,3,Small alone none him against expert himself.,2025-02-14
593,88,135,4,Discussion special shoulder watch be daughter available serious law available industry policy less back.,2024-08-19
