review_id,product_id,customer_id,rating,review_text,review_date
1,16,368,4,Edge school during ground continue despite change by support play piece.,2024-06-17
2,81,482,5,Attorney could community lay line blue current.,2024-05-03
3,91,499,2,Bar decision deal available former you always standard man home.,2024-05-27
4,7,230,3,Almost particular heavy high food serve smile smile attorney rise score.,2024-09-25
5,8,257,1,Money pressure because rest likely floor us health serious chair mind significant account.,2025-01-26
6,72,43,2,Market which firm bill station play deal data relationship.,2024-08-24
7,87,242,1,Grow several challenge attorney him beat how check.,2024-11-05
8,96,42,2,Space choose suffer green open idea.,2024-05-10
9,82,95,3,Office trade live model artist other senior speech may each certain.,2025-03-03
10,38,434,1,Throw charge middle happen guy husband against staff.,2025-03-03
11,54,254,3,Summer decide event energy seem forward indeed enough approach of.,2025-04-13
12,76,188,1,Everyone center less reduce piece me film able blood.,2024-09-23
13,15,385,2,Less billion former Congress whom kid eight road over lay their.,2024-09-17
14,92,307,5,On feel pull gas red amount main home message television.,2024-11-19
15,50,400,5,Group traditional actually grow southern discover factor call blood drug near no usually.,2024-05-30
16,56,167,4,Determine card they natural time carry theory grow staff admit.,2024-10-24
17,95,271,4,Push late product little air should concern tough.,2024-06-16
18,9,125,3,Me matter discover suggest mind start must.,2024-07-03
19,8,161,1,Least financial window play drive city debate third.,2024-11-25
20,19,87,4,Certainly her attention cover reflect education eight tree hospital.,2025-02-27
21,51,309,2,Sister front bed my whose short garden city out indeed both.,2024-11-27
22,72,489,5,Congress number though one religious one.,2024-09-25
23,98,226,1,Thank both feeling right identify glass war.,2024-08-19
24,57,145,5,Although somebody able create month soldier budget.,2025-01-03
25,68,345,1,National guess writer interest wear dark.,2025-01-02
26,31,248,4,Science suggest future become contain floor they election forget court capital.,2024-11-24
27,3,362,4,Full trial recognize two happen positive seat statement reflect.,2024-08-25
28,99,6,3,Consider much very director tough write.,2025-02-10
29,83,31,1,Enter five perform care rate later college his.,2025-03-05
30,43,197,2,Practice question wind example floor weight social detail law language.,2024-06-11
31,29,232,4,Phone sound himself toward just culture reason step administration.,2024-07-01
32,10,296,3,Set system prepare will them win development decide none save.,2024-09-03
33,12,414,4,Shoulder its find sport quality laugh information yeah material cultural.,2024-05-08
34,46,325,5,Again interesting first risk new world.,2024-11-20
35,30,460,4,Relate week six myself if onto none manage science.,2024-12-29
36,94,135,1,Might PM election season system see without single plan.,2024-04-24
37,82,493,3,Quite production western everybody fish rest knowledge necessary.,2024-08-12
38,88,13,1,Second cell letter develop ability choose power fund.,2024-05-02
39,32,497,2,School subject item hold commercial those any to stop many attorney million.,2024-12-27
40,73,4,2,Answer tell across environment finally between compare child as new science.,2024-04-24
41,47,178,4,Floor clear discussion guess under Republican think character history school she network.,2024-07-15
42,88,234,3,Last common morning chair Congress performance need author small.,2024-10-03
43,63,259,3,Day sister others how employee remain serve room production pattern voice box expect.,2024-05-08
44,26,140,3,Have performance something hair analysis which.,2024-08-14
45,3,65,3,Through protect fear nothing machine become off major lay long local him.,2024-11-16
46,23,283,4,Guy serve rather service effort son sister find standard.,2024-07-25
47,75,363,1,Common above send behind list arm identify girl factor travel.,2025-01-08
48,74,306,4,Response young window should set attention.,2024-09-19
49,50,205,1,Lawyer need store six walk current red billion bad common choose by.,2024-07-04
50,36,17,5,Child reveal lot minute change bar foot value enjoy example deal material.,2025-02-13
51,13,200,5,Identify politics us much result decade education do less field there woman record.,2024-10-26
52,29,32,1,Whole building approach that clear character serious contain administration door leg about.,2024-08-30
53,38,212,4,Coach stop process seek environmental at some high character generation free strong drug.,2025-01-26
54,77,435,2,Movement oil activity I there dinner myself son stay.,2025-02-06
55,90,273,4,Vote table someone beat Republican debate case top glass price.,2024-07-03
56,84,290,2,Something fact build after often project station community understand fight.,2024-09-19
57,5,291,4,Staff team manage consider give visit matter risk like yourself.,2025-02-07
58,20,483,3,Production two produce single someone whose you phone.,2024-10-31
59,78,486,3,Oil chair glass new whatever change recognize affect sound store.,2024-11-30
60,14,234,5,Republican final me no sport happen fly owner bad yes citizen.,2024-09-10
61,8,408,5,Who radio national run want present commercial quickly line worry.,2024-10-02
62,48,182,1,Attention evidence image identify attack mouth start away dog hand wall result hospital.,2025-01-20
63,13,146,2,Mouth write might short short amount them sell.,2024-06-16
64,24,50,3,Move actually rest experience by again fast.,2025-01-26
65,79,430,4,Decade piece institution weight one might long.,2025-03-01
66,65,432,1,Product society bed next attention trouble number.,2024-04-24
67,86,103,4,Else win similar such bad play college but pay citizen return during season apply.,2025-02-18
68,34,33,3,Best art lot adult for while on.,2024-12-25
69,51,497,3,After good style military standard as least record they actually finish.,2025-04-13
70,3,471,3,Affect matter me word attack feeling whole.,2024-09-30
71,90,89,3,Team term system action discover west right of reality region cause away face real.,2024-06-24
72,78,485,4,Face baby two though cell build high provide eight.,2024-10-07
73,58,411,1,Candidate break course college past citizen consider particularly.,2024-05-30
74,72,385,3,Cup suddenly democratic lot material stand reveal drop interview for.,2024-10-05
75,55,341,5,Attorney also present stand follow argue list throw including else chance politics.,2025-01-12
76,80,315,1,Fly event throw opportunity garden effort prevent between.,2024-11-17
77,42,241,5,Small we human past including Democrat hot method.,2024-12-25
78,21,266,4,Become professor minute write against describe.,2024-12-30
79,10,223,3,Happy whether total plan machine save deep themselves cultural consumer whose.,2025-01-04
80,57,236,1,Condition friend serve certain herself election finally take most participant just.,2024-12-01
81,25,153,3,Particular black oil budget prepare industry.,2025-01-10
82,56,468,3,Office onto strong single available base miss.,2024-06-02
83,38,57,1,Capital house way eight any stuff west a dog consider several focus TV.,2024-05-17
84,86,322,3,Level notice task exist also us home include social.,2024-08-18
85,61,375,3,Out care allow federal follow civil.,2025-01-20
86,47,112,2,Also government PM within response debate car leg.,2024-05-11
87,54,15,2,On by event our prove offer challenge.,2025-03-31
88,46,412,1,Citizen ok writer teacher career argue same popular.,2024-08-27
89,68,269,1,Year family car choose their season involve but let word.,2025-02-24
90,4,114,3,Result station avoid sister people cold field number attorney final study.,2024-12-15
91,94,252,5,Hotel near college chance most black media charge interview me owner agency early.,2024-07-12
92,66,500,1,Month reality ago benefit one animal lay.,2024-11-17
93,93,374,3,Good live go pick item apply science.,2025-04-16
94,43,142,5,Water wall common writer state this.,2024-12-29
95,62,114,2,Model fly power customer son every long.,2024-11-27
96,100,450,1,Well issue environmental whom protect hard him.,2025-03-30
97,85,290,3,Shoulder news training within wife recent.,2024-11-23
98,85,483,2,Nation foreign form lose instead training mean carry result audience ten each.,2024-07-09
99,85,357,4,Professor data strong mean win stop center always meet still common.,2024-09-12
100,4,25,2,Still prevent mean board office factor production off shake.,2024-05-06
101,65,368,3,Actually participant team finish star television.,2025-02-16
102,62,310,5,Skill television treat woman upon deep form.,2024-07-20
103,90,255,4,She future catch main ask whether ten school.,2024-05-17
104,2,463,4,Keep determine budget want much number now shoulder.,2024-09-08
105,9,268,4,Newspaper four question already three cold study consider building end situation.,2025-04-02
106,57,126,1,Hundred turn western bill civil surface inside choice entire audience hold argue return he.,2025-04-14
107,45,393,3,Right our item hope around design but cup where understand.,2024-12-07
108,18,250,4,Boy ready another number rule me religious list positive scene.,2024-07-11
109,48,287,2,Other financial serious as town member process Mrs glass evening.,2024-08-10
110,42,334,5,Market might leader own including house act business.,2024-10-28
111,41,477,3,Nice study authority process any but.,2024-11-13
112,75,53,2,Today join doctor color money again have public yes five better expect step.,2024-09-09
113,89,368,1,Pretty single necessary head road hot.,2024-12-23
114,90,43,4,Almost Democrat certainly lose goal treat specific member in operation issue.,2024-12-08
115,58,166,2,Actually situation herself future white family unit.,2024-06-30
116,100,42,3,Instead research so world hear remember common force almost group listen answer policy.,2024-05-18
117,42,380,2,Voice daughter phone old rest song benefit one lose.,2024-07-31
118,35,456,1,Cultural teach article view several both.,2024-07-22
119,38,176,5,Middle develop debate total effort present home their close.,2025-04-14
120,67,67,4,Who visit point agent white show coach for box sound scene.,2024-10-04
121,41,66,3,Trip member officer sound south thus point full suddenly would.,2025-03-23
122,99,400,4,Design social project season training challenge field film form appear then exactly baby.,2025-01-31
123,50,83,4,Animal those idea cause continue yourself former difficult my.,2025-01-26
124,86,350,4,Organization me evidence material charge hundred.,2025-02-03
125,72,105,2,Gun church painting figure single owner.,2024-09-23
126,79,400,2,Yourself explain establish view season gun everybody collection.,2024-09-14
127,45,287,5,Voice into eat election know price close one leg until change.,2024-10-23
128,71,374,1,Team movement check to style direction peace choice loss.,2025-03-20
129,19,186,3,Pass thank thought perhaps read high prepare animal save.,2025-01-03
130,17,284,2,Special suffer though gun design full past.,2024-07-15
131,65,4,4,Buy media visit itself list man share bag how nature source human will.,2024-09-04
132,93,138,1,Though fine dinner try stop once trouble close trial any despite cell most.,2025-04-01
133,77,179,3,Market relationship summer speech yes which church manager unit goal.,2024-06-23
134,56,237,3,Response recently forget son best ready could.,2024-07-02
135,93,18,3,Develop north already particularly sea nothing apply Republican your state.,2025-03-23
136,41,303,3,Through visit perform economic assume speech hundred lose.,2024-04-22
137,42,416,5,Our keep tree something yeah stock accept.,2025-03-30
138,6,414,3,Rather mother at become administration subject but specific community.,2024-06-22
139,69,420,1,Let bit first program discover whole source truth.,2025-04-12
140,98,9,2,Hand every officer million serious generation around edge room or since.,2024-04-30
141,75,420,1,Well head find join prove political sort worker recognize nor drive.,2024-11-02
142,73,29,4,Tree growth major most personal teach significant I agreement stock up.,2025-04-07
143,40,144,5,The rich American force seem here realize past into property discover paper model.,2024-10-18
144,41,348,5,Still bit suggest assume skill indicate situation similar.,2024-09-06
145,9,149,4,His whole week let store space institution hard us.,2025-03-28
146,8,64,1,Drive about less walk general some may.,2024-11-10
147,44,367,1,Industry particular run enough win fight against anyone movement.,2024-10-12
148,58,450,4,Huge agreement rather close miss for buy color.,2024-06-14
149,67,380,3,Rate fire type value sell protect agree argue our part positive.,2024-06-10
150,13,187,3,Seven among mother chance note everything create until early reduce.,2024-05-07
151,19,366,2,Long voice range edge lose out fact college season travel or build.,2024-09-07
152,98,227,1,Box program on poor rock serve fall father space race heavy.,2024-12-30
153,96,118,1,Affect opportunity open low wish feeling.,2025-02-03
154,49,412,4,Fear cultural on hit wide without result thought five your wonder.,2025-01-27
155,80,439,4,Go area oil rise water growth able exactly.,2024-09-13
156,100,356,3,Hold example wonder before almost outside.,2025-01-26
157,82,254,1,Data stock history education media wide prevent continue occur friend public.,2024-05-10
158,78,31,1,For west he author few good live tough civil lay.,2024-09-16
159,30,161,5,Everything investment step tough human similar case great report finally about.,2025-03-09
160,66,215,2,Look win able through relate agent economy from.,2024-11-10
161,77,444,2,Necessary without success use station program ask.,2024-12-22
162,91,169,3,Practice market us add majority room property memory candidate hot.,2024-08-13
163,59,81,1,Clear list space pick administration American small.,2024-08-03
164,53,46,5,Would mouth skin argue sister radio staff huge face push interview down movement.,2024-12-27
165,52,49,1,Lot medical worry energy learn kid good option hotel participant night establish.,2024-11-21
166,81,449,4,Animal anything find throw join forward throughout computer exactly talk.,2024-11-01
167,31,298,3,Food safe necessary game none force collection.,2024-09-10
168,15,407,2,Range foreign million memory cold agree nearly strategy conference most each nor center.,2024-12-26
169,20,368,1,Responsibility teacher try admit must prepare produce debate.,2025-01-14
170,5,283,3,American whose real wall energy within decision season factor.,2024-07-29
171,7,473,2,Since list meeting stand security yeah article performance leader perform.,2025-02-16
172,18,416,1,World pressure it like maybe story.,2025-02-13
173,56,467,5,Project Mrs history bar idea between talk pattern market.,2024-11-07
174,75,88,3,Protect professional ready cost husband dark according hour TV moment.,2025-02-07
175,96,121,1,Season east full against adult increase alone large event number card coach.,2025-04-11
176,91,3,2,Season total character report pass article good ready whether hard threat.,2024-08-01
177,90,316,2,Trade like full notice southern sing black suddenly.,2024-06-28
178,45,460,5,Miss eat nearly this soon radio take tonight.,2025-01-28
179,28,227,3,Practice individual film sing save care article usually wall.,2025-02-20
180,50,79,3,Door yourself best staff guy hour treatment toward girl.,2025-03-08
181,2,145,1,Worry administration treatment both development marriage tough social control interesting poor rise.,2024-11-04
182,84,242,2,Arm film such then eat end learn chair ten trial.,2025-03-29
183,68,32,2,Eat yet most difficult trial produce interview space prevent seek find it.,2024-05-08
184,77,263,5,Hot rock stuff need him figure purpose.,2024-06-21
185,24,211,5,Charge soldier official foreign each between public coach ok million.,2024-05-09
186,48,71,3,Off what describe lead travel above rate guy generation decade.,2024-05-14
187,45,384,2,Sea fire activity population eight scientist bar.,2024-07-17
188,93,197,1,Purpose space attention personal phone send summer Mr defense garden want chair.,2024-07-23
189,58,58,4,Back team culture positive fine single bag happen.,2024-09-09
190,36,424,1,Ahead want strategy general red rule moment put such fund year heart.,2024-07-15
191,2,469,5,Analysis ok nothing who share training represent box degree language other behind others.,2024-06-29
192,18,112,1,Coach main become stock both usually glass site appear only blood usually.,2024-05-12
193,49,48,2,Show defense arrive drug north listen one unit.,2024-07-30
194,8,435,3,Show chance establish bag project impact spring arrive remain.,2025-02-11
195,58,185,4,Stage guess animal wish do exactly baby remember sort.,2025-04-02
196,15,367,3,Relate agent recognize people nor current share media travel nice.,2024-10-17
197,17,327,4,Entire share key window like billion.,2024-12-30
198,23,165,4,Article skin apply others avoid father.,2024-07-13
199,66,215,2,Billion produce himself rise check generation resource.,2024-11-29
200,70,331,2,Approach fill above deep east military marriage this.,2024-04-26
201,93,330,5,Stage effect start explain interest him turn race arm.,2025-02-13
202,27,121,5,Notice approach attorney power thousand today report ever specific.,2025-01-02
203,37,213,4,Story little blue talk thought court place Democrat account guy open.,2025-02-18
204,49,311,5,Serve use man determine boy someone under.,2024-05-01
205,64,41,2,Indicate few TV activity rise apply travel environmental machine order around himself.,2025-01-15
206,34,353,5,Police though bed near type accept one among certain world share environmental role.,2025-01-06
207,18,404,4,Research these so gun guy figure daughter risk ask.,2024-10-20
208,64,289,3,Later there save but language arm.,2024-12-23
209,74,168,1,Marriage item bill TV friend information huge much simply.,2024-10-11
210,44,483,5,Concern he name these condition community window none collection eight or see plan.,2024-12-24
211,17,34,2,Energy begin surface always this history mind him sound build.,2024-09-16
212,59,318,3,Use husband that team person under million professional air notice there.,2024-06-10
213,13,484,2,Attack conference challenge herself knowledge get however area kid should eye.,2024-12-12
214,52,475,5,Business record able rule and first book develop listen may important focus officer.,2025-02-28
215,60,275,4,Such age sure recent vote movie this people institution matter.,2025-03-02
216,42,427,1,Determine either two lawyer culture newspaper probably customer among.,2024-09-28
217,91,197,1,Trade step all standard order one experience.,2024-12-26
218,64,191,3,Language scene house close good daughter condition always technology move.,2024-08-01
219,66,221,1,Tough owner voice everything boy so herself adult step by your finish.,2024-12-15
220,34,10,4,Own worker base return act those accept affect late.,2024-06-26
221,95,120,2,Through hand occur maybe second debate instead whole value room to.,2024-09-10
222,87,123,4,Continue would watch this opportunity measure should thought.,2024-09-06
223,71,247,3,Reveal have them adult white window as cup large into mouth case.,2024-07-14
224,64,360,3,Professor kitchen dog poor common these travel crime five character eight.,2025-03-21
225,33,397,1,Close consider maintain small off spring enjoy although agent.,2024-09-23
226,12,221,4,Wife staff expert recently animal show baby leg remember politics.,2024-08-05
227,76,261,2,Morning chance above year you return.,2025-03-25
228,19,58,4,Month away sea gas minute us economic.,2024-10-08
229,9,315,2,Offer start miss admit really support appear place husband sell set.,2024-05-05
230,74,460,2,Weight before serve trial sometimes with weight.,2024-11-22
231,17,128,4,Then low land born play career work.,2025-02-24
232,50,187,5,Public to suddenly agree tonight home travel either piece fish behind news.,2024-06-05
233,39,205,4,Born consumer board at relationship leave decade table question.,2025-02-25
234,41,86,2,Ever drive apply through full travel tonight station free heavy.,2025-02-03
235,10,104,3,Run administration investment keep during agent current guess agent movement interesting article identify.,2024-04-29
236,12,143,3,Begin magazine series physical someone car.,2024-11-29
237,79,205,1,What late movie hand between but school lay.,2025-03-28
238,95,129,3,Support song form possible woman across bar center none bag and lot.,2025-04-16
239,15,246,5,Part inside call left per political know imagine.,2024-12-07
240,28,38,2,Blue fact organization high catch statement compare right each town feel.,2024-11-23
241,4,363,4,Tend she citizen upon foot not successful feeling partner.,2024-05-24
242,36,109,4,Street since mean exactly bank after have point season focus go might laugh.,2024-12-13
243,65,309,5,Gas its best exist father off responsibility teach answer name policy bed.,2025-02-11
244,98,52,3,Mission budget throw light bed Mr threat identify.,2024-12-20
245,47,1,2,Unit note laugh under him billion south toward author painting subject main green.,2025-01-26
246,81,11,3,Blue fly beautiful spend if class order rich sign stuff account.,2024-11-06
247,39,314,1,Top power understand night college just above writer parent fact listen because.,2025-02-12
248,38,235,3,Particular them fire reality medical do event future follow.,2024-04-29
249,44,128,1,Director surface option rate doctor happen arrive rise experience win might.,2024-04-30
250,51,424,4,Then himself only candidate blue American course news whole describe because send town.,2024-07-07
251,97,214,2,Young administration network believe few tough here word particular seat memory really.,2024-10-21
252,85,483,1,Mean bed his best some bad think record mention director ago Congress.,2024-08-30
253,26,444,3,Bag challenge outside brother ever miss news official provide if.,2024-10-14
254,36,243,3,Ground whose theory hold develop artist performance color movement young second.,2025-04-14
255,69,44,4,Often book strong future camera cost player Mrs recent environment everyone quite benefit.,2025-01-10
256,97,6,5,Human animal religious today any into management ready executive somebody radio show.,2025-01-21
257,1,156,5,Improve her people industry themselves serve state like enter in interesting.,2024-08-10
258,53,415,3,Whatever mind goal where picture point should become camera note part part.,2024-07-28
259,6,8,5,Call provide land section of ground save training his career PM.,2024-05-06
260,37,5,2,Store prevent success firm coach strategy create power believe scientist spring allow significant.,2025-01-03
261,2,362,5,Bit source international kind case pressure last shoulder point bank door.,2024-10-01
262,69,182,2,Important pull know true per how age.,2024-09-16
263,90,112,3,Chance under land light free agency make base against expect.,2025-01-03
264,41,492,3,Time those look want determine none them kid down eye.,2025-01-01
265,51,273,3,Act smile plant against service dinner begin activity its who enough class.,2025-03-30
266,47,422,4,Degree rate continue almost argue break yard certainly less player look see.,2024-09-17
267,13,265,5,Opportunity student others should almost standard lot free.,2025-01-12
268,76,458,1,Hard knowledge material budget area red home large morning article level occur.,2024-05-21
269,69,212,1,Could nor charge drug program serious conference example member throw brother.,2025-03-12
270,66,78,3,Current report or suddenly name positive property still send Democrat second.,2024-08-09
271,59,270,5,Amount modern else just century the should figure when discuss especially most attack.,2024-09-09
272,68,154,2,Probably true wonder old maybe even different road.,2024-05-24
273,59,221,1,Hour remain week might for data ready never.,2024-05-15
274,91,369,3,Finish prove challenge for condition middle team sign over give light capital since.,2024-05-10
275,10,446,1,Population office region its imagine factor use economic stay practice.,2024-07-10
276,13,347,1,Ability note letter one note cold protect.,2024-12-22
277,2,25,1,Argue onto require else stand interview director somebody we feeling capital.,2024-10-22
278,90,464,3,Age commercial or respond step term whose tell one catch service.,2024-05-25
279,15,420,3,What group oil behavior strategy democratic trip evidence natural.,2024-08-14
280,46,354,4,How city professional development work response what until throughout bad about note.,2024-07-19
281,57,208,4,Past ever purpose population still chair yeah than dream product idea vote long.,2024-10-29
282,10,417,4,Take they lawyer score culture challenge old serve night item.,2025-02-22
283,22,3,1,Laugh while pick certain that writer with family line.,2025-01-26
284,89,215,5,Bring break fact southern field ability parent probably resource.,2025-01-18
285,79,395,3,Start race away continue best development rule measure tax movement stage.,2024-07-08
286,77,112,4,Discuss know finish hold agent discover before talk point learn deep.,2024-07-21
287,8,442,5,Every around young bill ten weight score all discover visit much focus describe.,2024-12-25
288,21,192,4,Enough different right occur white her white student next.,2024-07-25
289,85,402,4,Sing authority blood operation modern cause candidate morning before stock allow themselves system.,2025-02-24
290,22,47,5,War then church trouble perhaps try very change fast.,2025-02-20
291,97,489,4,Put ok book if thus human ever.,2024-10-19
292,45,428,1,Decade some official attack ten skill national city carry because land agency.,2024-09-13
293,91,221,1,Enough feeling general how remember summer difficult within summer industry dinner.,2024-08-16
294,40,187,1,Store participant chance sing suffer fine different year place environment risk same.,2024-05-05
295,22,50,2,Single store your fine audience ok head we identify check attention kind.,2025-02-27
296,30,197,4,Beyond claim major pass scene note capital wonder.,2024-06-10
297,62,216,2,Think owner recent those example whether body listen.,2025-02-07
298,73,413,3,Face more leader include night leg experience project result culture discuss.,2025-03-22
